{
  "meaning_fidelity": 0.98,
  "reasoning_fidelity": 0.95,
  "voice_fidelity": 0.94,
  "evidence_discipline": 0.93,
  "genre_fitness": 0.96,
  "ai_template_density": 0.02,
  "rhetorical_overfitting": 0.03,
  "artificial_imperfection": 0.00,
  "notes": [
    "Eliminated AI buzzwords: 'fast-paced digital ecosystem', 'game-changing paradigm', 'silver bullet', 'delving deeper', 'in conclusion'.",
    "Restored concrete grounding with latency millisecond figures (180ms -> 30ms).",
    "Maintained nuanced boundary condition regarding eventual consistency vs monotonic read consistency.",
    "Integrated user's authentic paragraph architecture: Problem framing -> Mechanical explanation -> Operational hazard -> Actionable short sentence anchor.",
    "No Failure Taxonomy alerts triggered (F01-F18 clear)."
  ],
  "failure_taxonomies_detected": []
}
